,page_num,text
22,22," Bu dokümanda HASSAS bilgi bulunmamaktadır. / This document does not contain SENSITIVE information. A letter from the concerned country mentioning the mechanism of property ownership Important Note: The broker is not entitled to issue Sale Contracts or receive any amounts from the client whether for reservation or against the value of the real property. The purchaser shall ensure the legal procedures in the country of the concerned party and shall inspect the property before executing a contract, and before paying any amounts, in the event of breaching this circular, RERA shall take its approved legal procedures. Thank you for your cooperation. Faithfully Yours, Ali Abdulla Al Ali Director of Real Estate License Department Date: 0810912016 Circular(10 2016 ) Messrs/ Real Estate Brokerage Dear Sirs, Subject: Fulﬁllment of License Requirements and Issuance of Broker's Card RERA extends its warmest regards and thanks you for your cooperation. In reference to the aforementioned subject, and pursuant to Regulation no. 85 of 2006 regulating real estate brokers register, and in pal glit 2006€ accordance with Articles (3, 6 and 12) of the Regulation, So all holders and partners in real a estate broker licenses and who had not obtained a real estate broker card shall complete the approved procedures and apply for the real estate broker card within a period not exceeding 15 11 2016. In the event of not adhering to this circular, the penalty speciﬁed under the Executive Council Decision no. 25 of 2009 shall be applied. Thank you for your cooperation, Faithfully Yours, Ali Abdullah Al Ali Director of Real Estate License Department Date: 03/08/2016 Circular No. (8/2016) To all Real Estate Broker Ofﬁces Greetings, Subject: Verifying Real Estate Title deed In reference to the above subject, this is to inform you that real estate brokers are responsible for preserving the rights of customers and investors. Accordingly, the feature of verifying the title deed is provided through a smart application (Dubai brokers). Any person can enter title deed and verify the information. Therefore, we request all real estate brokers to download the application and verify the title deed before performing any real estate sale or rental transaction. "
23,23," Bu dokümanda HASSAS bilgi bulunmamaktadır. / This document does not contain SENSITIVE information. Thank you for your cooperation and response. Yours sincerely, Ali Abdullah Al Ali Director of Real Estate Licensing.    "
24,24,"  :التاريخ 14/07/2022  :المرجع DLD/OUT/2022/0004440  تعميم ( 2022  01)     السادة/ مكاتب الوسطاء العقاريين المحترمين... تحية طيبة وبعد... الموضوع: ربط التصاريح العقارية بعقد التسويق االلكتروني A  تنوه مؤ سسسسسسسسسسسسسلسسسسسسسسسسسسسسم طلقنتبس طلوتسسيل سس سس م من ت لسسسسسسسسسسسسب لسسسسسسسسسسسس بسس طلخدميت طلقحول طلرقمي لإلجرطءطت طلخيصسسسسسم يلقصسسسسسيلعق طلوتيلعم  طعقبسسيلطم م تسسيلع 1/8/2022 سسسسسسسسسسسسسوو قس لع عتوي طلبب طلسس بسسم A م تيم طلقصسسسسسسسسيلعق طلوتيلعم حبع حلسسسسسسسسقد تح ب سسسسسسسسخم م طتفيقبم طلتلسسسسسسسسسسسسوع طسوق  طلوسسسسسسسسسسسسسب طلبيئ ف طلنتيم ط قفيء يخيل لقس عتد طلتلوع A ف طلنتيم. ع ب دعو ج ب طلوس يء ط لتزطم يسقخدطم طلوتوي طل بم لكي ق كنوط م طلحصول على طلقصيلعق طلخيصم يإلعال يت طلوتيلعم.  وتفضلوا بقبول فائق االحترام والتقدير... Circular )01 2022(   Dear Real Estate Brokerage offices. Greetings,  Subject: linking real estate permits with the real estate e  marketing contract   Form A  As part of our mission to simplify and facilitate our offered services and digitalise real estate permits, starting 1 Augu st, the Real Estate Regulatory Agency’s smart real estate e  marketing contract (Form A) will be linked with the real estate permit system As such, a marketing agreement that needs to be signed by a broker and a seller can be fulfilled online by completing Form A, entering the contract number, and submitting it.  Moving onward, we encourage all brokers to commit to using smart contracts when it comes to permits for real estate advertisements.  Best regards ,      علي عبدهللا آل علي مدير إدارة أول "
25,25,"a.� .2019/01/01 � .ill�J �I 1...14 t° JAi� _...L.....J I .... _. t; ·., 11 � � I      . '  · _cc,,...,,,� The Real Estate Regulatory Agency Land Department R E R A Governme nt of Dubai Lh..ll •. t.:.·.�11 L..u.,·i,f.) � ..,...,, Date: 20\06\2018 Circular ( 2 2018) To ALL Real Estate Companies and Real Estate Brokerage Firms Dear Sirs, Subject : Amending Terms of the Permit for Marketing Properties Abroad RERA extends its warmest regards and thanks you for your cooperation. Reference to a.J_.,..ul �L>  <'t .<' .�� ,L�I .....Jo1 .�.Li.aJI  · t:..:�tl �·  <' L,:: i �J .   'i'J � >j 4 i :: ,   the abovementioned subject, and further to our previous circular no (13 of 2016) dated 2/11/2016 with a view to increase the confidence of Investors and Customers in the Real Estate Market, and protect the rights of all parties, we would like to inform you that it is decided to add a new clause under the Special Terms related to marketing properties for real estate abroad. This new clause is as follows: ""the necessity of providing a Bank Guarantee in a value of 10 million Dirhams in favor of the RERA for incomplete projects"", this is in addition to the other previously approved terms. This amendment shall be applicable to all the new permits and those whose renewal is required. And all companies with prior permits amend their circumstances in accordance with this circular before 2018\06\20 : f�I ( 2018 2) � LJ:4 �, )� L�� �� ..bJ,_.t �..I.JU :e, eg.l. l J o�I J_,s'.UI �.,.ti dl oJL!.""i4J .� �l..ul �Jt....:i u 'lJ • 2016/11;2 J t.)J ll (2016/13) iJ.) �4 uWJr u 4, ':?Jla...JI J__,..JI J �l.ait.lJ ��I a...iS o.l½J � ' .,jl_,.b'il � Jyi> �l4o> J� �GJI .,b .. .:dt J,..i..1.> ..u.i a.s�I   ..u .uL a.bl>'il.) · 4.r ' .. . . ' .) >4' . ' ij 1e �.,,I.Aj) J A J o).,4',/1 J a.JJ..ul �� w 4 uGU... J:., 3 �� · . .:.q Ll � �L �.) , ...__,� 10 � <',. •e 1 ·­.) J:'W 1,....!) • • 1  >J ..,� ... � (Jl.4 ,.,jO �I J �L..., o�I ' 5.»�I ..b�I JJ a.il.o',14 (o.JA4  '�l.)WJ.I � �J • 0 4..1 ..�.H e,�I � � J:..i..ai!I l..i.A �� � �� JI J:..1 ..lU ¼L... e,� i., .1... �WI u!S""�I 01/01/2019 •••• Ua.o �JW � � �fiLl, Thank you for your cooperation, Eng. Marwan Bin Ghulaita · 1 ....�, ..u.l�.. J! 1· :'.l/1 ·•\j J · 1 f,.__;_., �rlr>. � � �jFaithfully Yours, � � ..1 4.>I uIJJ 4 ·r CEORERA "
26,26,"                                                                                 التصاريح العقارية ت صريحتسويقعقاراتمن خارجالدولة المستنداتالمطلوبة: 1  رسالةمنالجهاتالرسميةفيبلدالعقاربعدمالممانعةمن تسويقالمشروعاوالعقار. 2  .نسخةمن ملكيةالعقار 3  نسخةمنعقدتسويقبين مالكالعقارومكتبالوسيط العقاري. 4  رسالةرسميةمنالجهاتالحكوميةفيبلدالعقارتوضح تقلنسبةانجازالمشروع �نسبةانجازالمشروعويجبان عن50 .) (للمشاريعالغيرجاهزه % 5  ماية مبالغاو �تعهد منمكتبالوساطةالعقاريةبعدماست اصدارعقودالبيع منالمكتبحيثانه يتعينعلى المشتريمعاينةالعقاراوالمشروعقبلالشراءوالتعاقد مباشرة مع مالكالعقارفيالبلدالمعني. 6  تقديمضمانبنكيبقيمة 10 ييندر �م همبالنسبةللمشاريع الغي رجاهزهحسبالنموذجالمعتمدللضمانالبنكي. حظه: �م  المستنداتالواردةمنخارجالدولةيجبان تكونمصدقة ماراتووزارةالخارجيةومترجمةباللغة ...منسفارة العربيةعنطريق مترجمقانوني.  .ن�ع...لتزامبذكررقمالتصريحفي ...يجب  رسومالموافقةعلىالتصريح 1020 درهم . Permit of marketing real estate a board Required documents: 1 A Letter of No Objection to marketing the project or the prope rty to be issued by the official authorities in the country in which the property is located, 2 Copy of the title deed of the property 3 Copy of a Marketing Contract executed between the Property Owner and the Real Estate Brokerage Firm. 4 An official letter issued by the government authorities of the country in which the property is located , clarifying the percentage of completion of the project , which shall not be less than 50% (for the incomplete projects) 5 An undertaking issued by the Brokerage Firm not receiving any amounts or issuing any Sale Contracts from the Firm; the purchaser shall inspect the property or project before purchase and it shall execute a contract directly with the owner of the property in the concerned country. 6 Provide a Bank Guarant ee in the sum of 10 Million Dirhams for in complete Projects as per approved form of bank guarantee Notice :  The documents coming from abroad shall be attested by the Embassy of UAE and the Ministry of Foreign Affairs and shall be legally translated into Arabic  The number of the permit shall be mentioned in the announcement.  Permit fees 1020 Dh. RERA/RL/LP. Cond.s / No.39/Vr.1/ Issue Date: Jun.2018 "
27,27,"                                                       ــىجــري ⸮⸮ ـزامــتـ ــصنــب ناــــمضــلا ـيـــكـنـبــال ـنأد ـاه دمــقــوي ىــلا سةسمؤ ملتنظيا يقارالع Please consider the following as a sample bank guar antee letter for RERA Sample of a bank guarante e of permit to marketing real estate a board جذمون مض نا كيبن قيتسول ات منعقار رجاخ ةلالدو Date: To: Real Estate Regulator agency (RERA )  Dubai خ:رياالت مؤسسة لى:ا منظيالت يرالعقا نترميالمح  يدب Dear Sir, Our Trade License Guarantee: For AED 10,000,000 (Ten million Dirham’s only) In consideration of your granting to: Dubai, UAE a permit to marketing real estate a board , We hereby undertake to pay to you or your accredited Representative on first demand any amount submitted to us by you in respect of claims arising out of any dispute, provided that such payment shall not exceed AED 10,000,000 (ten million Dirham’s only) This payment shall be made by us on your request and despite of any contestation of the part of: This validity of the guarantee is unlimited and shall continue in force unless otherwise informed by you. ةحيت ة وبعــد ,,ــطيبـ رفيمصلننا اامض لغ:مبة برياجلتة اخصرلل 10,000,000 رةرهم ( عشد ⸮ييدرهم ن طقف ) مكحنملًارـــظن ةداــــسلا : بيد – م ع. ا. ولةدال خارج نم تراقاع يقوستل حيتصر دنتعه , نهوبلتط لغبم يأ بطل أول دنع لمخولا مكلممثل وأ ملك دفعن نأ ذابه نأ رطبش عانز يأ نع جةتنالا تبالمطالا صوصبخ ⸮ اوزتجي بلغ :الم كذل . 10,000,000 هم ( عشرةدر م ⸮ فقط ) مدره نيي امكً دهعتن ميدقتب غلبملا ءانب ىلع مكبلط ضغبو رظنلا نع ةيأ ةعارضم نم رفلطا : ادةلسا ًم غير نالضما دةم صب ايراس نامضلا اذه لظيو , دودح رةتممس ةف ا ⸮ . لكذ كسبع ناوتما أبلغذا RERA/RL/LP/2.1.1.OP1.P4.S13 _F.8/Vr.1/ Issue Date: Jun.2018 "
28,28,"  :التاريخ 11/04/2023  :المرجع DLD/OUT/2023/0002268     تعميم (02   2023)    /السادة جميع الشركات والمؤسسات العقارية  المحترمين تحية طيبة وبعد  الموضوع: تطبيق نظام رمز القارئ السريع (QR Code) بالنسبة لإلعالنات العقارية بداية تهديكم مؤسسة التنظيم العقاري أطيب التحايا وتشكر لكم تعاونك م الددددامم معندددا. بدددارةدددددددددددددددار إلى املوضدددددددددددددو أعاله ومن منطلق تطوير وتحدددديددد إجراءات الحوكمددة العقدداريددة فيدددددددددددددو دددددددددددددددا يمددا ي ارعالنددات العقدداريددة نفيدكم علما بأنه قامت مؤسدسدة التنظيم العقاري بتطوير نظام التيدار يح العقارية، بحي يتم إ دددددددددار رم القارئ السددددددددر (QR Code) ألي تيددددددددريح عقاري من نظام ترافيصددددددى وععى جمي الشددددددر ات العقارية االتزام بوضدددددد رم القارئ السدددر QR Code ععى جمي ارعالنات العقارية سدددواء املرمية أو املقروء ممددددا سدددددددددددددو يمكن املتعددددامل ن من التددددأكددددد من ندددددددددددددحددددة ارعالن العقاري وأنه معتمد من مؤسدددسدددة التنظيم العقاري وذلك اعتبارا من تاريخ 15/4/2023 مالحظةهامة: ندعو جمي الشدددددددددددددر ات العقارية االتزام بالتعميم اليدددددددددددددا ر حي ان قيمة املخالفة في حالة عدم االتزام 50 ألف رهم مقدرين تعاونكم الدامم معنا..  وتفضلوا بقبول امق ااحترام والتقدير    Circular )02 2023(  Dear Real Estate Brokerage Firms  Greetings  Subject: Appl ying the QR code system for real estate ads   RERA appreciate s your continued cooperation and support in its efforts to moderni se and improve real estate governance procedures. As part of this initiative, we would like to inform you that the Real Estate Regulatory Agency has introduced a new system for issuing real estate permits using Quick Response (QR) codes, accessible via the Trakheesi system. Effective 15th April 2023 , all real estate companies are required to include the QR code on their advertisements, whether in print or audio   visual format. This will enable customers to easily verify the authenticity and validity of the advertisement, ensuring that the Real Estate Regulatory Agency has approved it . Important note: We would like to emphasize the importance of adhering to the circular, as the fine in case of non  compliance is AED 50,000.  We appreciate your continuous cooperation. Regards,    علي عبدهللا آل علي مدير إدارة أول "
29,29,"�Jl� I�..)&. Cf) Q •JI f1' I t; .. i JI i...____.,..._ .. ...,, •I.>   ° The Real Estate Regulatory Agency .!I� )'I )'I �ylJ Land Department _., IJ""""'°IJ R R A Government of Duba i Date: 18\12\2016 2016\12\18 : ?..Hl' Circular ( 21 2016) Dear real estate brokerage Firms Greet ings Subject: Standard forms for leasing RERA extends its warmest regards and thanks you for your cooperation. With regards to the above topic, and to regulate the mechanism for real estate brokers working in the field of real estate leasing brokerage and to protect the rights of all parties, all real estate brokers should use the approved real estate forms for leasing properties. Thank you for your cooperation, Attachment: A copy of the standard Fonns ( 2016 21 ) et"":? �� ., .�1.:....11 �l �L..aJI �I L...w_;.. �.J f ½I� . Li.a..iwl.J.11 �Jl.a.i J.o. � Jlb..i.o Vo ' . .,�, .)�.ill t,  .o.,.l l JI OJL..t)'� .:.GLi.a.ll_ei.. J �L...._,JI J4u J �WI �,;Li.a.II �lla....._,.11 �,;Li.a.II �lh........._,J I � � • ..,jl_,Jo'i l � J# �t. _, .:.GLi...ll_eb J �' _,.14 �WI o�I t�L..i.ll r l.u.i. 1 ....14lll I  ""I  ·Li J  I· 1.:.. � 0j!. .., r'�f' """" � ,_...., .:.liJ _,..   .,.r.1 t.iW.11.:,,. �. Ali Abdullah Al Ali Director of Real Estate License Departmen �Li.a.J I �_;J I o).)J .)'!. ..1.4 T028 "
30,30,
31,31,
32,32,
33,33,
34,34,
35,35,
36,36,"  :التاريخ 02/08/2022  :المرجع DLD/OUT/2022/0004772   تعميم )3  2022)    /السادة منصات التسويق العقاري  المحترمين تحية طيبة وبعد...    العقاري الخاصة بالتسويقالشروط واالحكام الموضوع: على المنصات     بداية تهديكم مؤسسسسسسسسسسسساسسسسسسسسسسسة ا  م ا  أط ب ا ح ت وتشسسسسسسسسسسسكر كم ت ونكم ا دائم م . ب إلشسسسسسس إلى املوضسسسسسسو أن م ومق م  حوكمسسة اإلن نسس ت ا سس سسة إلن سس ا املد سسد مق املصسسسسسسسسسسسسسسدا سسة وحمسس يسسة ح وق املاسسسسسن مر ق وامل م ا سو ا اسسسسسوق ا اسسسسسوق ا  ن دكم ن مسسسس بسسسسأنسسسسو ي ولسسسسب ناى لم امل صسسسسسسسسسسسسسسسس ت ا سسسس سسسسة امل سسسسة ب شسسسسسسسسسسسسسر اإلن ن ت ا  ة اال تزام ب وليه ت ا  ة: 1. ندم نشسسسسسر أ ان ا ن  ا ل ح ىسسسسسح ناى صسسسسسر سسسسسس مق مؤ ساة ا  م ا  . 2. يجب ا أكد مق صسسسسسسسسسسسمة ا صسسسسسسسسسسسر مق  ا ر اال كتلون املولود ب ا مؤساة ا  م ا  و امل صة ا  ة. 3. يجب حديث ب ن ت اإلن ن ت بشسسسسسسسسسسسسسلح دو مق  ا راب اال كتلون م املؤسسساسسة ب اسس ة  ات ا  م ت د م وةر بحسسهة سس مق املو أو ك سس بسسة ( م ا  بخ ك ل وواضسسسسسسسسسسسسس ناى اإلن ا). 4. يجسسسسسسسبأا كوا ب سسسسسسس نسسسسسسس ت اإلن ا ا سسسسسسس م سسسسسسس ب  سسسسسسس نسسسسسسس ت ا صر ا ص د مق املؤساة.  م د ق ت ونكم ا دائم م ...  Circular )3 2022 (  Dear / All r eal estate portals  Greetings   Subject: Terms and conditions for r eal estate marketing on portals   RERA extends its warmest regards and gratitude for your continued cooperation. Regarding the above topic and in pursuit of the governance of real estate advertisements to grant more credibility and protect the rights of investors and customers in the real estate market, we would like to inform you that all real estate portals concerned with publishing real estate ads must adhere to the following directives:  1. Real estate advertisement s without an official permit from the RERA are not allowed to be posted. 2. The permit must be verifiable through the integration between RERA and the real estate portals . 3. The content of the ads must be updated periodically through RERA’s integration properties that are no longer available must be delisting from the site (or proclaimed clearly on the ad in written form that it has been sold out .) 4. The real estate advertising information must reflect the information of the permit s issued by RERA.  We appreciate your continued cooperation . "
37,37,"      علي عبدهللا آل علي مدير إدارة أول  م ح سسسسة هسسسس مسسسسة: سسسسسسسسسسسسسسوق كوا ه سسسس ا سسسس بسسسسة ناى لم امل صسسسسسسسسسسسسسسسسس ت ا  ة أكد مق اال تزام بههم ا شسسسسسسسسسسسسروي واالحل م وسو ح ة ندم اال تزام سسسسسسسسسسسسسسوق ي م ا خسسسس اإللرااات ا سسسس نون سسسسة امل مسسسسد بمسسسس ةيهسسسس حجب أو إي ق املو مق نشر اإلن ن ت ا  ة. و ض وا ب و ة ئ االحتلام وا دير Important note: All real estate portals will be monitored to ensure compliance with these terms and conditions . In cases of non  compliance, the approved legal measures will be taken, including blocking or stopping the site from publishing real estate ads.  Regards, "
38,38,"  :التاريخ 20/07/2022  :المرجع DLD/OUT/2022/0004542   تعميم (2  2022)  السادة/ جميع الشركات والمؤسسات العقارية المحترمين تحية طيبة وبعد...  الموضوع: الشروط واالحكام الخاصة باإلعالنات العقارية تنوه مؤسسسسسسسسسسسسسسسسسسسسسسة التنجي العقسسسا بسسسا سسس يتوجسسس  جميع الشركات والمؤسسات العقارية الراغبة بالتسويق أو الترويج للعقسسسسا ات ن طايق القنوات اإ ال يسسسسة المةتلمسسسسة بمسسسسا ي سسسسا المنصسسسسسسسسسات العقارية أو قنوات التواصسسسسسسسسسي ا جتما ا ا لت ا بالشروط واألحكا التالية:  1 يجب الحصوووووى عص صووووريح رسووووم لم الم سووووةووووة و ابة رقم ال صريح في اإلعالن  2  : يجب أن ي ضووووووومم اإلعالن سووووووووامق ان لقروماق أو لرئياق اسوووووووم الشر ة العقارية المعلنة 3  بالنةوووولة للمشوووواريي العقارية ال لاع عص الخارنة يجب أن ي ضوووومم اإلعالن اسووووم الموور و اسووووم المشووووروع ورقم المشووووروع ولوقي المشروع ورقم حةاب الضمان المع مد. 4  الشوووور ة المعلنة كون ل المةووووصولة عم صووووحة ولصووووداقية لح وي اإلعالن ويجب أن ال ي ضووووووووومم اإلعالن أي لعلولات ير لع مدة في ال صريح الصادر لم الم سةة   Circular )2 2022 (  Dear Real Estate companies and agencies Greetings  Subject: Real Estate ads Terms and conditions RERA instruct A ll real estate companies wishing to market or promote properties through various advertising channels, including real estate pl atforms or social media must commit to the following terms and conditions: 1  Must obtain an official permit from RERA and the permit number must be display on the ad . 2  The ad, whether written or visual , must include the name of the real estate company. 3  For real estate projects that are sold off  plan, the advertisement must include the developer's name, project name, project number, project location and app roved escrow account number. 4  The advertising company is responsible for the validity and credibility of the advertisement content , and the advertisement must not include any information that has not been approved in the permit issued by RERA. 5  A promo tional campaign permit must be obtained for advertisements that include promotional campaigns, such "
39,39,"  5  بالنةوولة لالعالنات ال  ضوومم حمالت رويجية لثل قديم ةوووووووووميالت أو لميفات أو خ يضووووووووووووات أو اع وووامات لم بع الرسوم يجب الحصوى عص صريح حملة رويجية. 6  يمني لنعوواق بووا وواق ال ةووووووووووي أو ال روي عم نريالمكووالمووات الملاشووورة لغير األشوووخال المةوووجليم في نقام القائمة الخضووورام المع مدة لم ل سةة ال نقيم العقاري  مالحجة هامة: سسسسسسسسسسوم تلبق المةالمات  ا سسسسسسسسسركة تلت ب ذه الشروط وا حكا  as the free benefits, value added facilities, discounts, or fees exemptions, others. 6  It is strictly forbidden t o market or promote through direct calls unless the person is registered in RERA   approved green list. Important note: Violations will be issued to any company that does not comply with these terms and conditions   وتفضلوا بقبول فائق االحترام والتقدير،،،    علي عبدهللا آل علي مدير إدارة أول  "
