,page_num,text
0,0," Bu dokümanda HASSAS bilgi bulunmamaktadır. / This document does not contain SENSITIVE information. The Real Estate Regulatory Agency Government of Dubai Date: 03/08/2015 Circular 11 To: Real Estate Management Supervision Companies Subject: Compliance with the laws regulating the work of property management companies Greetings… With reference to the above subject and to safeguard the rights of all parties and comply with the laws governing the work of the real estate management supervision companies, All companies must comply with the following: 1. The license and staff involved in property management supervision and the properties managed by the company must be registered in the Ejari. 2. Management supervision companies are’ nt allowed to receive any rental payments on behalf of the company, all cheque must be in the name of the landlord e. In the event of non compliance with this circular penalty contained in Law No. (2) of 2003 regulating the lease of property in the Emirate of Dubai applies: (Whoever violates this law is to be punished by a fine not exceeding AED 500,000) We highly appreciate your cooperation with us. Yours sincerely For Register In Ejari Program Please Visit Our Office In Land Department  Property Rental Affairs Sector. Ali Abdulla Al Ali Director of Real Estate Licensing Department The Real Estate Regulatory Agency Government of Dubai Circular 11 Date: 03/08/2015 To: Real Estate Management Supervision Companies Subject: Compliance with the laws regulating the work of property management companies Greetings… With reference to the above subject and to safeguard the rights of all parties and comply with the laws governing the work of the real estate management supervision companies, All companies must comply with the following: 1. The license and staff involved in property management supervision and the properties managed by the company must be registered in the Ejari. 2. Management supervision companies are’ nt allowed to receive any rental payments on behalf of the company, all cheque must be in the name of the landlord e. In the event of non compliance with this circular penalty contained in Law No. (2) of 2003 regulating the lease of property in the Emirate of Dubai applies: (Whoever violates this law is to be punished by a fine not exceeding AED 500,000) We highly appreciate your cooperation with us. Yours sincerely For Register In Ejari Program Please Visit Our Office In Land Department  Property Rental Affairs Sector. Ali Abdullah Al Ali Director of Real Estate Licensing Department "
1,1," Bu dokümanda HASSAS bilgi bulunmamaktadır. / This document does not contain SENSITIVE information. Circular (14 2016) Date: 22/11/2016 Subject: Time Share Contracts Messrs/ Companies operating in the field of leasing units on a time sharing system basis. Greetings, RERA extends its warmest regards and thank you for your cooperation. In reference to the abovementioned subject, we would like to inform you that all the brokerage companies operating in the field of leasing residential units on a timeshare basis shall adhere to the following: 1  Not issue any lease contracts for units byee the company. 2  Not receiving any amounts related toee contract.ee Note: The role of company is brokerage only. In the event that the client desires to execute a contract, then the contract shall be made between the purchaser and the property owner, and accordingly under such contract shall be paid directly to the owner. In the event of breaching this circular then the legal procedures followed by RERA shall be applied. Thank you for your cooperation… ENG / Marwan Ahmed Bin Ghleita Executive Manager   RERA The Real Estate Regulatory Agency Land Department RERA Government of Dubai Date: 12/01/2016 Circular(1 2016) To all real estate brokerage firms Greetings Subject: Renewal of Broker's Card RERA extends its warmest regards and thank you for your cooperation. In reference to the aforementioned subject, and for the purpose of maintaining the provision of excellent services to investors and clients, brokers shall adhere to renewing their cards on the time specified for such renewal. In the event of not renewing the card within two weeks from the card's expiry date, the broker shall be required to Certified Training for Real Estate Brokers as a precedent condition to renew his card. Therefore, we invite all brokers to adhere to the content of this circular. Thank you for your cooperation. Faithfully Yours Ali Abdullah Ali Director of Real Estate License Real Estate Regulatory Agency Land Department Government of Dubai RERA ﻢﯿﻈﻨﺘﻟا ﺔﺴﺳﺆﻣ ﻲﺑد ﺔﻣﻮﻜﺣ كﻼﻣﻷاو ﻲﺿارﻷا ةﺮﺋاد يرﺎﻘﻌﻟا Date: 2015/12/31 :ﻢﻗﺮﻟا 2015/12/31 Circular(26) ) ﻢﯿﻤﻌﺗ 26( To all real estate brokerage firms ﻦﯿﻣﺮﺘﺤﻤﻟا ﺔﯾرﺎﻘﻌﻟا ﺔطﺎﺳﻮﻟا ﺐﺗﺎﻜﻣ ءارﺪﻣ / ةدﺎﺴﻟا Greetings ﺪﻌﺑو ﺔﺒﯿط ﺔﯿﺤﺗ Subject: Brokerage Firms Classification عﻮﺿﻮﻤﻟا ﺔطﺎﺳﻮﻟا ﺐﺗﺎﻜﻣ ﻒﯿﻨﺼﺗ : RERA extend its warmest "
2,2," Bu dokümanda HASSAS bilgi bulunmamaktadır. / This document does not contain SENSITIVE information. regards and thank you for your continuous cooperation. ﺚﯾﺪﺤﺘﻟا ﺔﯿﻠﻤﻌﺑ يرﺎﻘﻌﻟا ﺺﯿﺧﺮﺘﻟا ةرادإ تأﺪﺑ ﻢﻜﯾﺪﻟ ﺔطﺎﺳﻮﻟا ﺐﺗﺎﻜﻣ تﺎﻧﺎﯿﺒﻟ ﻞﻣﺎﺸﻟا With reference to the subject mentioned above, and based on circular NO: (13) regarding the classification of brokerage firms, we would like to bring to your attention that the classification is applied only on brokerage firms who has real estate buying & selling brokerage activity. ﺑﺎﻹﺷﺎرة إﻟﻰ اﻟﻤﻮﺿﻮع أﻋﻼه، و ﺑﻨﺎءً ﻋﻠﻰ اﻟﺘﻌﻤﯿﻢ رﻗﻢ )13( ﺐﺗﺎﻜﻣ ﻒﯿﻨﺼﺘﺑ ﻖﻠﻌﺘﻤﻟا ﻧ نﺄﺑ دﻮﻧ ،ﺔطﺎﺳﻮﻟا (ءاﺮﺷو ﻊﯿﺑ ﻲﻓ ﺔطﺎﺳﻮﻟا) لﺎﺠﻣ ﻲﻓ طﺎﺸﻧ ﺎﮭﻟ ﻲﺘﻟا ﺔطﺎﺳﻮﻟا ﺐﺗﺎﻜﻣ ﻰﻠﻋ ﻖﺒﻄﯾ ﻒﯿﻨﺼﺘﻟا نﺄﺑ ﻢﻜھﺎﺒﺘﻧا ﺖﻔﻠ ﻂﻘﻓ تارﺎﻘﻌﻟا .Best Regards ماﺮﺘﺣﻻا ﻖﺋﺎﻓ ﻊﻣ ،،،Ali Abdulla Al Ali Director of real estate license department رﺎﻘﻌﻟا ﺺﯿﺧﺮﺘﻟا ةرادإ ﺮﯾﺪﻣ ﻲﻠﻌﻟا ﷲﺪﺒﻋ ﻰﻠﻋ ي The Real Estate Regulatory Agency Land Department RERA Government of Dubai ﻢﯿﻈﻨﺘﻟا ﺔﺴﺳﺆﻣ ﻲﺑد ﺔﻣﻮﻜﺣ كﻼﻣﻷاو ﻲﺿارﻷا ةﺮﺋاد يرﺎﻘﻌﻟا Date: 2016/11/30 ) :ﻢﻗﺮﻟا 17   2016( ) ﻢﯿﻤﻌﺗ 17   2016( Circular To Companies and Real Estate Agencies ﻦﯿﻣﺮﺘﺤﻤﻟا يرﺎﻘﻌﻟا عﺎﻄﻘﻟا ﻲﺒﺴﺘﻨﻣو تﺎﻛﺮﺷ / ةدﺎﺴﻟا Greetings ﺪﻌﺑو ﺔﺒﯿط تﺎﯿﺤﺗ Subject: Development of Trakheesi System ﺺﯿﺧاﺮﺗ مﺎﻈﻧ ﺮﯾﻮﻄﺗ :عﻮﺿﻮﻣ Warmest greetings, and thank you for your cooperation with us in promoting the services provided to our customers. ﺎﻨﻠﻣأو ﻢﻜﻣﺎﻤﺘھا ﻰﻠﻋ ﻢﻛﺮﻜﺸﻧ كﻼﻤﻟاو ﻦﯾﺮﻤﺜﺘﺴﻤﻟاو يرﺎﻘﻌﻟا عﺎﻄﻘﻟا ﺔﺤﻠﺼﻣ مﺪﺨﯾ ﺎﻤﯿﻓ نوﺎﻌﺘﻟا ﻦﻣ ﺪﯾﺰﻤﻟا ﻲﻓ ماﺮﻜﻟا ﻦﯾﺮﺘﺸﻤﻟاو As part of our continuous efforts to provide the best services to our customers, we are currently assessing services of Trakheesi Real Estate License & permit services to improve and develop this service based on your future needs and expectations. وﺣﺮﺻﺎً ﻣﻨﺎ ﻋﻠﻰ ﺗﻘﺪﯾﻢ أﻓﻀﻞ اﻟﺨﺪﻣﺎت ﻟﻠﻤﺘﻌﺎﻣﻠﯿﻦ ﻧﻮد اﻹﻓﺎدة ﺑﺄﻧﻨﺎ ﻧﻘﻮم ﺣﺎﻟﯿﺎً ﺑﺈﺟﺮاء ﻣﺮاﺟﻌﺔ ﺷﺎﻣﻠﺔ ﻟﺨﺪﻣﺎت ﺗﺮاﺧﯿﺺ ﻣﺰاوﻟﺔ اﻟﻤﮭﻦ اﻟﻌﻘﺎرﯾﺔ وﺗﺼﺎرﯾﺢ اﻟﺒﯿﻊ ماﺮﻜﻟا ﻦﯿﻠﻣﺎﻌﺘﻤﻟا تﺎﺟﺎﯿﺘﺣاو تﺎﻌﻠﻄﺗ ﻊﻣ ﻖﻓاﻮﺘﯾ ﺎﻤﺑ تﺎﻣﺪﺨﻟا هﺬھ ﺮﯾﻮﻄﺗ فﺪﮭﺑ ﻚﻟذو ﺔطرﺎﺨﻟا ﻰﻠﻋ Kindly fill the survey form through the following Link and send it to us no later than Thursday 15 12 2016 مﻮﯾ هﺎﺼﻗأ ﺪﻋﻮﻣ ﻲﻓ ﺎﻨﯿﻟإ ﮫﻟﺎﺳرإو ﻖﻓﺮﻤﻟا نﺎﯿﺒﺘﺳﻻا ﺔﺌﺒﻌﺗ ﻰﺟﺮﯾ ﻖﻓاﻮﻤﻟا ﺲﯿﻤﺨﻟا 15 12 2016 https://goo.gl/q9N6JE https://goo.gl/q9N6JE Faithfully Yours, ﺮﺘﺣﻻاو ﺮﯾﺪﻘﺘﻟا ﻖﺋﺎﻓ ﻊﻣ ما Ali Abdullah Al Ali Director of Real Estate License Department ﯾرﺎﻘﻌﻟا ﺺﯿﺧاﺮﺘﻟا ةرادإ ﺮﯾﺪﻣ ﻲﻠﻌﻟا ﷲ ﺪﺒﻋ ﻲﻠﻋ /ﺪﯿﺴﻟا ﺔ The Real Estate Regulatory Agency Government of Dubai RERA Date: 2016/11/30 Circular (16 2016) To Real Estate Brokerage Firms Greetings Subject: Development of Brokers System The Dubai Land Department sends its warmest greetings and thank you for your cooperation. As part of our continuous efforts to provide the best services to our customers and in order to improve and develop services currently provided to all customers and brokers, we kindly ask you to fill out the survey through the following link and get back to us no later than Thursday 15 12 2016 https://goo.gl/qfxj Faithfully Yours, Ali Abdulla Al Ali Director of Real Estate License Department The Real Estate Regulatory Agency Government of Dubai RERA "
3,3," Bu dokümanda HASSAS bilgi bulunmamaktadır. / This document does not contain SENSITIVE information. Date: 2015/09/08 Circular (13) To Real Estate Brokers Offices Greetings Subject: Brokers Offices Classification In terms of raising the efficiency of services provided by the real estate brokers and in order to regulate the real estate market, it was resolved to apply the Brokers Offices Classification System in accordance with the following categories (Gold, Silver, and Bronze) based on particular criteria. And that will be launched and published on the Brokers Information System and the public can access it from 01/01/2016. Therefore, we ask all Real Estate Offices to log into the Brokerage Offices System (classifications) and update the details regarding the internal system of the office. Sincerely Yours Ali Abdulla Al Ali Director of Real Estate Licensing The Real Estate Regulatory Agency Government of Dubai RERA Date: 2016/10/08 Circular no. (11 2016) To All Real Estate Companies and Institutions operating in Dubai After Greetings. Subject: Real Estate Announcement Permits RERA extends its warmest regards and would like to thank you for your cooperation. In reference to the above subject, we would like to notify you that we have launched a new e service related to real estate permits within the Trakhees system. Accordingly, all real estate companies and institutions which desire to publish a permit announcement through the system are required to apply for obtaining a permit on the same system. Real estate companies and institutions will be notified if their permit has been approved or not through the e mail registered with the system. As of 1/10/2016, legal procedures and administrative sanctions provided in the circular no. (20 2015) shall be taken against the violating companies. We appreciate your cooperation. His Excellency/ Marwan Ahmed Bin Ghalita Executive Manager – RERA The Real Estate Regulatory Agency Government of Dubai RERA Date: 2019/04/10 Circular (02 2019) To Real Estate Development Companies Greetings Subject: Registration of marketing and sales staff at the Real Estate Regulatory Agency RERA extend its warmest regards and thank you for your cooperation. With reference to the above subject, and in order to regulate the real estate marketing and raise the efficiency of sales and marketing employees to reach the best services provided to all customers and investors. We communicate the need of registering all the marketing and sales staff working for the company and get a Real Estate Marketer card after passing the training course through the Dubai Real Estate Institute. All companies and institutions working in the field of real estate development are required to communicate the names of the employees and their positions to the circular issued within two months from date. To register in the course: www.drei.ae To get the Real Estate Marketer Card: www.trakhees.gov.ae We appreciate your cooperation. Eng. Marwan Bin Ghulaita CEO RERA "
4,4," Bu dokümanda HASSAS bilgi bulunmamaktadır. / This document does not contain SENSITIVE information. 1 The real estate regulatory agency Land department RERA Government of Dubai Date: 10/04/2016 Circular (4 2016) To all companies providing furnished residential units services on the basis of timeshare Greetings Subject: suspension of stand permits RERA extends its warmest regards and thank you for your cooperation. In reference to the aforementioned subject, and in pursuance of Dubai Law no. (3) of 2014 on the regulation of timeshare and furnished hotel apartments activities, and the executive regulations thereof issued by decision no. (15) of 2014, we have decided to temporarily suspend the issuance of stand permits related to furnished residential units until a new mechanism is issued regulating this activity. Noting that the previously issued permits shall remain valid until the expiry of stand lease contracts. Thank you for your cooperation Faithfully yours Ali Abdullah Ali Director of real estate license department The real estate regulatory agency Land department RERA Government of Dubai Date: 7/12/2015 Circular (20) To all real estate brokerage firms The subject: smart system ""Dubai Brokers"" RERA extends its warmest regards and thank you for your cooperation. In view of the introduction of the smart system ""Dubai Brokers"" which was launched on 15/11/2015, and in line with RERA's keenness to develop services and raise the level of transparency and quality in the real estate sector in the emirate of Dubai, we would like to inform you that as of 03/01/2016, all the Real Estate Advertisement in the Emirate of Dubai must be submitted through the ""Dubai Brokers"" smart application available on (IOS) and (Android) Accordingly, we kindly request that you update your advertisements in line with the aforementioned date, noting that no real estate advertisement will be accepted through other means. We look forward to your cooperation in implementing this system, which aims to regulate the real estate brokerage sector and enhance its efficiency and transparency. Best Regards Ali Abdullah Ali Director of real estate license department The real estate regulatory agency Land department RERA Government of Dubai Date: 8/12/2016 Circular (18 2016) To the attention of property portals firms Dear Sirs, Subject: Electronic Connectivity RERA extends its warmest regards and thanks for your continuous support and cooperation. In reference to the aforementioned subject, we would like to inform you that in line with RERA's aim to support transparency in the real estate market and pursuant to circular no. 11/2016 issued on 29/08/2016 regarding the electronic connectivity between real estate portals and RERA, and following the circulation of the requirements for all electronic real estate portals operating in the emirate of Dubai, we would like to inform you that as of 03rd Feb. "
5,5," Bu dokümanda HASSAS bilgi bulunmamaktadır. / This document does not contain SENSITIVE information. 2017, all the Real Estate Advertisement in the Emirate of Dubai must be submitted through RERA's smart application available on (IOS) and (Android). Accordingly, we kindly request that you update your advertisements in line with the aforementioned date, noting that no real estate advertisement will be accepted through other means. We look forward to your cooperation in implementing this system, which aims to regulate the real estate brokerage sector and enhance its efficiency and transparency. Thank you in advance for your cooperation and prompt action. Faithfully yours, Ali Abdullah Ali Director of real estate license department The real estate regulatory agency Land department RERA Government of Dubai Date: 12/05/2017 Circular 21 To all real estate brokerage firms Greetings Subject: Broker ID card RERA extend its warmest regards and thank you for your cooperation. We would like to inform you that RERA procedures and training for all real estate agents are in place. Be aware that as of 03rd Feb. 2017, all the Real Estate Advertisement in the Emirate of Dubai must be submitted through RERA's smart application available on (IOS) and (Android). Please note that in accordance with the Brokerage Law, it is prohibited for any broker to deal with a client who is not registered in the system. In case of non compliance with circular RERA will take the legal action against the violator. Best Regards Ali Abdullah Ali Director of real estate license department The real estate regulatory agency Land department RERA Government of Dubai Date: 07/01/2019 Circular (01 2019) To all Real Estate Valuation Firms Greetings Subject: Launch of the smart application (Taqeemi) We would like to thank you for your continued cooperation. With an aim to develop services facilitate procedures and transfer knowledge in the real estate sector into smart services, please Be aware that as of 03rd Feb. 2017, all the Real Estate Advertisement in the Emirate of Dubai must be submitted through RERA's smart application available on (IOS) and (Android). Based on the above, we inform you that RERA has launched a smart application named (Taqeem) for all valuation transactions carried out by the firm. Please download the application through (IOS) , Android stores. Thank you for your cooperation Faithfully yours, For any inquiry about the application, please contact: support@eres.ae Eng. Marwan Bin Ghulaita CEO The Real Estate Regulatory Agency Government of Dubai RERA Circular (01 2021) Date: 23/06/2021 "
6,6," Bu dokümanda HASSAS bilgi bulunmamaktadır. / This document does not contain SENSITIVE information. Dear Real Estate Brokerage Firms Greetings… Subject: Marketing and promoting overseas properties RERA would like to thank you for your continued cooperation. With regard to the above subject, and as part of our efforts to regulate the marketing and promotion of overseas properties as well as to protect the rights of buyers and investors, we would like to inform you that the real estate brokerage offices is limited to marketing promotion and brokerage in the sale of properties registered in Dubai; this activity does not authorize a broker to market or promote properties located outside the UAE. As such, activities that they want to market and promote in Dubai, bearing in mind that the activity of the representative office is limited to marketing, promotion and providing data only to those wishing to purchase these properties after receiving the permits from RERA. The broker must also be informed of the legal procedures in the event of a violation, legal procedures will be taken. We appreciate your continued cooperation. Best Regards, Eng. Marwan Bin Ghulaita CEO RERA The Real Estate Regulatory Agency Land Department Government of Dubai RERA Date: 26/3/2012 Circular To All Real Estate Offices RERA extend to you our warmest regards…….. Referring to the above subject, in order to provide the best services, we would like to inform you that broker card expiry date is now linked with your office certificate expiry date. Please note that broker card renewal fees will be adjusted based on the validity of the licenses when processed. Appreciate your co operation Director of Real Estate Licensing Department The Real Estate Regulatory Agency Land Department Government of Dubai RERA Date: 1/3/2012 Circular To: Real Estate Brokerage Offices RERA would like to thank you for your cooperation. With this circular, we would like to inform all real estate brokerage offices to abide by the RERA rules and regulations for real estate brokerage. Real estate brokerage offices must mention the registration number and broker ID card number in all newspaper, magazines and email advertisements. According to Decree No. 25 of 2009, RERA may impose a fine of 50,000 dirham to the companies are not following this rule. Senior Director of Real Estate Licensing Department "
7,7," Bu dokümanda HASSAS bilgi bulunmamaktadır. / This document does not contain SENSITIVE information. The Real Estate Regulatory Agency Land Department Government of Dubai RERA Date: 6/12/2011 Circular To All Time Share Company’s RERA extend its warmest regards and thank you for your cooperation…….. In pursuit of RERA to regulate the real estate profession. In accordance with law No.16 of 2007. Your company is required as of this date to abide by the condition of issuing the marketing permits as follows: 1. Collecting any amount of money by Real Estate companies is prohibited. 2. Real Estate brokers are not allowed to follow or intercept clients. 3. Real Estate brokers obligated to wear the brokerage card at all time. 4. Promoting of marketing campaign is subject to approval of RERA. 5. Corporation with official permits and licensed companies. Failure to comply may consider a violation of the licensing terms condition and regulation issued by RERA and result in imposing the administrative fine on you in accordance with Executive board decision No. 25 of 2009. Director of Real Estate Licensing Department Ref: RERA/EMS/30362012 Date: 03/06/2012 Subject: Simari Registration Reminder Dear Valued Brokers, Just wanted to send you a quick friendly reminder that the Simari registration period is ending soon and the launch date is on July 1st, 2012. In case you have not received our thank you letter which was mailed to you on May 22 – 2012please follow the following steps below in order to register in Simsari: 1. Go to http://simsari.ae/simsarisoft/Default.aspx 2. Click “Register” office (if your office has not been registered yet) and complete the registration process. 3. Once RERA approves your registration request, you will receive an activation notification by email. 4. Login as an office administrator and select all brokers to be activated, then they can register themselves without any prior approval from RERA. 5. Once brokers are activated, then they can start using Simsari. Again, thank you for your support and together we can make Simari a success story. For any inquiries, call us at +971 4 203 0457/ 800 CALLERES or email us support@rera.ae Kind regards, Real Estate Regulatory Authority Dubai Date: 26/3/2012 Circular To All Real Estate Offices RERA extend to you warmest regards……… Referring to the above subject, RERA is pleased to announce the implementation of the Continuing Education Program as of January 1st, 2012. This Program has mandatory for all brokers in Dubai and require to attend a broker’s test and pass it to receive an activation for broker’s ID renewal. For any inquiries, please contact RERA at telephone number: 04 203 0456 "
8,8," Bu dokümanda HASSAS bilgi bulunmamaktadır. / This document does not contain SENSITIVE information. or email us certifiedtraining@rera.ae Appreciate your co operation Director of Real Estate Licensing Department The Real Estate Regulatory Agency Land Department Government of Dubai RERA Date: 06/04/2014 Circular No (3/2014) To All Real Estate Agencies Subject: Sale of owners details With reference to the above subject and in line with the regulation and development of the brokers' activities. It is strictly forbidden to deal with people who are related to property owners either by e mail or SMS who offer such information in promoting and marketing of real estates or SMS. You are required to carry the sale through to the owners directly with property owners without a request by the owners asking the broker to carry the sale. Non compliance with this circular is against licensing terms and regulations issued by RERA which will result in fines as per the Executive Council Decision No 25 of 2009. Your commitment and cooperation is much appreciated Deputy (CEO) Date: 2014/09/24 Circular (12/2014) To All Real Estate Leasing Brokerage Offices Subject: Rent payments In the framework of the organization of the real estate market and to protect the rights of all parties, brokers are not allowed to register a rental contract where a fine could be issued to the employer if the broker is the one who signed the contract. Failure to comply with the conditions, regulations and rules of the licensing terms by administrative decision in accordance with RERA and result in imposing fine based on the board decision No.25 of 2009. Senior Director of Real Estate Licensing Department Date: 2011/11/23 Circular To All Real Estate Agency RERA extend its warmest regards and thank you for your cooperation. RERA would like to announce to all sole proprietorship working in the real estate brokerage that a new job title (Real Estate Agent) has been issued by the Ministry of Labor in coordination with RERA as of this date. "
