,page_num,text
9,9," Bu dokümanda HASSAS bilgi bulunmamaktadır. / This document does not contain SENSITIVE information. Therefore, you are kindly required to modify the job title of real estate agents working with you to the new title once submitting the application to renew their residency visa. Director of Real Estate Licensing Department Date: 2013/2/3 Circular To All Time Share Company's (canceling time share) RERA extend its warmest regards and thank you for your cooperation. Referring to the above subject, in pursuit of RERA's activities, in accordance with law No.16 of 2007, to regulate real estate offices and issue new amendments and cancel the agreement and allow all investors of your company to transfer and refund any amount of money provided that you sign the agreement within 10 working days from the date of this notice and payments made by the subscriber shall be returned to him within 15 working days from the day of submitting the cancellation application. Your company is authorized to transfer 1000 shares not less than AED 1000/ . Failure to comply with this circular will result in administrative charges. Failure to comply with the conditions, regulations and rules of the licensing terms by administrative decision in accordance with RERA and result in imposing fine based on the board decision No.25 of 2009. Director of Real Estate Licensing Department Government of Dubai Land Department Circular 3 25/11/2013 In the pursuit of Dubai land department to control the real Estate registry in the Emirate of Dubai so that it reflect all actions which lies on the real estate units to achieve the protection of the rights of all parties ,the Land Department extend its greeting to all those adhere to relevant real estate laws. The department emphasizes on fulfillment of the obligations of all the developers who have collected any government fees on behalf of the Land Department as it is deemed public funds. For the implementation of Resolution No. 30 of 2013 on the fees of real estate transactions, all developers are required to transfer the public funds immediately when collected, and in the case of delay in the transfer, this is considered as evasion of the government fees as stated in Article 5, paragraph 3 of the resolution. Accordingly, in the event that any party or developer or broker has collected any fee related to Real Estate transaction before the application date 10/6/2013 and has not duly transferred to the new fee will be applied when submitting the application and any extra fees shall be responsible for the payment of any other fees at the time of applying for registration, in addition to any fines required by the law. "
10,10," Bu dokümanda HASSAS bilgi bulunmamaktadır. / This document does not contain SENSITIVE information. Sultan Butti Bin Mirin General Director of Dubai Land Department The Real Estate Regulatory Agency Government of Dubai RERA Circulation to all real estate leasing and brokerage offices The Real Estate Regulatory Agency (RERA) of Dubai is directing this circulation to all of the real estate leasing offices and brokerage offices to comply with the conditions, regulations and work ethics. It became clear that some offices have refrained from leasing properties to certain nationalities and this is unacceptable and contrary to the efforts of the Dubai government to make Dubai a city where economic, commercial, real estate, and other activities are conducted in a transparent and equal manner. RERA is making this circulation to inform everyone that RERA will impose penalties on violators of the work ethics provided by the decision of The Executive Board of Dubai No.25/2009 where a fine could be issued up to AED 50,000 (fifty thousands dirham) We would like to thank all the real estate offices for their cooperation with RERA as this will help serve the interest of Dubai and strengthen its strategic position in all sectors Senior Director of Real Estate Licensing Department Date: 06/04/2014 Circular No (1/2014) To All companies operating in the residential sector Subject: Promotion Campaigns Starting from today, it is prohibited to market residential units to prospective clients by giving away free gifts or whether by giving free weeks, free facilities not mentioned in the purchase contract. Non compliance with this circular is against licensing terms and regulations issued by RERA which will result in a fines as per the Executive Council Decision No 25 of 2009. Your commitment and cooperation is much appreciated. Deputy CEO Date: 10/03/2013 Brokerage offices Classification project Dear Brokerage office Subject: Brokerage offices Classification project RERA thanks you for your continuous work to improve the real estate market. One of our new projects is to classify Real estate brokerage companies. Your company has been selected for trial classification. We appreciate providing us with the following documents: 1  Organization structure 2  Broker register 3  Quality systems/awards/ ISO Please deliver these document within five days working days to the licensing department. Thank you for your support Director of real estate licensing department "
11,11," Bu dokümanda HASSAS bilgi bulunmamaktadır. / This document does not contain SENSITIVE information. The Real Estate Regulatory Agency Land Department RERA Government of Dubai Date: 23/9/2012 Circular To All Real Estate Companies Involved in Other People's Property Management and Real Estate Management Supervision RERA extend its warmest regards and thank you for your cooperation. In order to improve Dubai real estate industry and to organize real estate procedures, and to serve and protect public interest, this is to notify that all the companies with above activities should register their office with RERA and obtain an office registration number. Employees who are involved in those activities must complete RERA real estate management course and obtain broker ID cards. We thank everyone for their cooperation with RERA for the benefit of Dubai and to enhance its strategic position in all fields. Director of Real Estate Licensing Department The Real Estate Regulatory Agency. Land Department. Government of Dubai. RERA. Date: 30/09/2013. Circular. To All Real Estate Agency. Subject: Non receipt of any advance payment. Based on No. (85) for the year 2006. "
12,12," Bu dokümanda HASSAS bilgi bulunmamaktadır. / This document does not contain SENSITIVE information. Real estate brokers studies prevent the receipt of any amounts private buy the property as mediator or an office brokers real estate where the deposits must be under the (seller) and saves at the mediator until the completion of the procedures for selling the property. Note In cases If the real estate offices do not obey this circular legal action will be taken. Director of Real Estate Licensing Department. The Real Estate Regulatory Agency The Real Estate Regulatory Agency Land Department RERA Government of Dubai Date: 21/10/2012 Circular To All Real Estate Agency RERA extend its warmest regards and thank you for your cooperation... regarding the above mentioned topic. As first phase of launching Sim sari system, We have completed the training for real estate brokers to maintain a high level of professionalism in brokerage work environment. Therefore, it has been decided that all brokers should start using Sim sari for all their real estate transactions and property listings from 01/01/2013. Pursuant to this circular, RERA shall take legal action against all real estate offices violating this directive starting from 01/01/2013. Thank you for your support and together we can make Sim sari a success story. For any inquiries, call us at +971 4 203 541 or 800 CALLERS or email us at support@eres.ae Director of Real Estate Licensing Department The Real Estate Regulatory Agency Land Department RERA 27/5/2012 Circular concerning Broker ID Card RERA would like to thank you for your cooperation "
13,13," Bu dokümanda HASSAS bilgi bulunmamaktadır. / This document does not contain SENSITIVE information. Please note that in accordance with RERA procedures All real state Agents are required to wear their broker ID when visiting land department or dealing with a client. failure to comply may result into taking legal action against the violator We thank all Real Estate Companies for their cooperation with RERA Senior Director of Real Estate Licensing Department The Real Estate Regulatory Agency The Real Estate Regulatory Agency Government of Dubai RERA Date: 10/10/2012 Circular To all companies involved in organizing real estate exhibition RERA extend its warmest regards and thank you for your cooperation In order to improve Dubai real estate industry and to organize real estate exhibition permits, this is to notify that all companies want to book for real estate exhibition must pay 10,000 dirham Non refundable deposit which will be adjusted in the final bill. This is to insure that companies will fulfill their obligations. We thank everyone for their cooperation with RERA for the benefit of Dubai and to enhance its strategic position in all fields. Director of real estate licensing department The Real Estate Regulatory Agency. Land Department. RERA. Government of Dubai. Date: 16/09/2014. Circular (11/2014). To All Time Share Company's. "
14,14," Bu dokümanda HASSAS bilgi bulunmamaktadır. / This document does not contain SENSITIVE information. Subject: Customer service. Failure to comply may consider a violation of the licensing terms condition and regulation issued by RERA and result in imposing the administrative fine on you in accordance with Executive board decision No.25 of 2009. Director of Real Estate Licensing Department. The real state regulatory agency Land Department RERA Government of Dubai Date: 11/6/2014 Circular (4/2014) To All Real Estate Offices Subject: Broker ID card Renewal RERA extend its warmest regards and thank you for your cooperation…….. We would like to inform you that from today’s date, it is a mandatory requirement for all real estate brokers applying for their ID card renewal to have passed DREI’s annual real estate brokerage examination. All applications for the renewal of real estate broker ID cards must now have the certificate confirming their examination pass attached. From today’s date, no applications will be processed without this document. Kindly note that brokers must sit the DREI examination date and result in the applicant having to undergo a DREI real estate training course as a condition for their ID card renewal. The fees for the examination and training course are as follows: Exam fees: AED 700 Training course fees: AED 2500 To register for the training course, please visit: www.drei.ae www.rrei.ae Date: 21/03/2013 ul? Dear Distinguished Gentlemen / Offices of Real Estate Brokers, Subject: Trakheesi System In an effort to improve the services and procedures provided to real estate brokers and in a transition toward the services, we have launched our new system ""Trakheesi"". The new system will help all brokers in submitting all their procedures online without the need to visit Dubai Land Department. Please visit the following website and register now in Trakheesi system: www.dubailand.gov.ae Select from electronic services (Trakheesi System) Please note that you can use the same password of Simsari system to login to Trakheesi system. You may also note that all procedures submitted through customer service will not be accepted in 3 months from the date of receiving this announcement. Thank you for your cooperation. Real Estate Licensing Department The Real Estate Regulatory Agency Land Department RERA Government of Dubai Circular Date: 11/08/2013 To All Real Estate Agency contacting properties owners "
15,15," Bu dokümanda HASSAS bilgi bulunmamaktadır. / This document does not contain SENSITIVE information. Regarding the above mentioned topic. All real estate brokers are not allowed to sms or call property owners if their properties ae or f listed by the owner for sale or rent as per the used templates by the real estate offices. In cases if the real estate offices do not obey this circular legal action will be taken. For more inquiry contact us on 042221112 The Real Estate Regulatory Agency Government of Dubai RERA Date: 10/10/2012 Circular To all companies involved in organizing real estate exhibition RERA extend its warmest regards and thank you for your cooperation In order to improve Dubai real estate industry and to organize real estate exhibition permits, this is to notify that all companies want to book for real estate exhibition must pay 10,000 dirham Non refundable deposit which will be adjusted in the final bill. This is to insure that companies will fulfill their obligations. We thank everyone for their cooperation with RERA for the benefit of Dubai and to enhance its strategic position in all fields. Director of real estate licensing department The Real Estate Regulatory Agency Land Department RERA Government of Dubai Date: 23/9/2012 Circular To All Real Estate Companies Involved in Other People's Property Management and Real Estate Management Supervision RERA extend its warmest regards and thank you for your cooperation. "
16,16," Bu dokümanda HASSAS bilgi bulunmamaktadır. / This document does not contain SENSITIVE information. In order to improve Dubai real estate industry and to organize real estate procedures, and to serve and protect public interest, this is to notify that all the companies with above activities should register their office with RERA and obtain an office registration number. Employees who are involved in those activities must complete RERA real estate management course and obtain broker ID cards. We thank everyone for their cooperation with RERA for the benefit of Dubai and to enhance its strategic position in all fields. Director of Real Estate Licensing Department The Real Estate Regulatory Agency Land Department RERA Government of Dubai ﻢﯿﻈﻨﺘﻟا ﺔﺴﺳﺆﻣ ﻲﺑد ﺔﻣﻮﻜﺣ كﻼﻣﻷاو ﻲﺿارﻷا ةﺮﺋاد يرﺎﻘﻌﻟا Circular Date: 11/08/2013 To All Real Estate Agency Regarding the above mentioned topic. All real estate brokers are not allowed to sms or call property owners if their properties ae or f listed by the owner for sale or rent as per the used templates by the real estate offices. In cases if the real estate offices do not obey this circular legal action will be taken. For more inquiry contact us on 042221112 The Real Estate Regulatory Agency Land Department RERA Government of Dubai 27/5/2012 Circular concerning Broker ID Card RERA would like to thank you for your cooperation Please note that in accordance with RERA procedures All real state Agents are required to wear their broker ID when visiting land department or dealing with a client. failure to comply may result into taking legal action against the violator "
17,17," Bu dokümanda HASSAS bilgi bulunmamaktadır. / This document does not contain SENSITIVE information. We thank all Real Estate Companies for their cooperation with RERA Senior Director of Real Estate Licensing Department The Real Estate Regulatory Agency The Real Estate Regulatory Agency Land Department Government of Dubai RERA 01052012/c Date: 01/05/2012 Subject: Invitation to Simsar! Registration Session Greetings from RERA! On behalf of RERA, we are pleased to invite you to become a member of our latest new product called Simsar!. Simsari is an enterprise, authenticated and trusted Multiple Listing Service (MLS) portal that regulates real estate brokers and enables them to establish contractual offers. Initiated by Dubai Land Department (DLD) and Real Estate Regulatory Authority (RERA) and developed by Emirates Real Estate Solutions (ERS), as a response to the growing demand for a trusted and regulated MLS in the real estate market. Through Simsari, buyer brokers can search for property listings, wherever they are listed, in a matter of seconds. This revolution in smart real estate transactions is available only through Simsari. The registration session will be held on May, 10th, 2012 from 3:00pm   4:00pm in Dubai Land Department's Conference Room on the 4th floor,during this meeting, we will provide product presentation, member onboarding, and registration access Thank you for taking the time to read this letter and to respond by no later than May 08, 2012 by phone at +971 4 203 0541 or +971 4 2030541 or by email at support@rers.ae Kind regards, Yousef Abdulla Al Hashimi Director of Real Estate Licensing Department, RERA The Real Estate Regulatory Agency Government of Dubai RERA Date: 05/11/2013 Subject: Become eMart trusted member eMart Greetings from Dubai Land Department! "
18,18," Bu dokümanda HASSAS bilgi bulunmamaktadır. / This document does not contain SENSITIVE information. On behalf of the Real Estate Regulatory Agency, I am writing to request a meeting at your earliest convenience regarding our latest on line real estate trading portal known as eMart and how it might serve as a resource to you. eMart is an online portal designed for owners and all real estate professionals to list their properties in Dubai for sale through direct sale, auction and for rent. It also provides an extremely convenient way to promote investment opportunities to all those who are interested in Dubai Real Estate Market from all over the world. The meeting will be held on November 20th, 2013 from 12:00 noon to 1:00 pm in Emirates Real Estate Solutions conference room in Dubai Land Department's the 1st floor. Thank you for taking the time to read this letter and to consider being a part of eMart. For RSVPs please respond by no later than November 19th, 2013 by phone at +971 4 203 0541 or 800 CALLERES or via email at support@rer.ae Kind regards, Yousef Abdulla Al Hashimi Deputy Executive Director of RERA The Real Estate Regulatory Agency Date: 30/09/2013 Circular To All Real Estate Agency Subject: Conditions of Outdoor Advertisement Regarding the above mentioned topic for officers on the written consent of the property owner 1  for officers on the written consent of the property owner 2  Do not put more than one billboard on the property 3  painting advertising should mention the registration number of the office and No. Broker 4  You must be the advertising panel in good condition and undamaged and be in Arabic and English Director of Real Estate Licensing Department The Real Estate Regulatory Agency Land Department Government of Dubai RERA "
19,19," Bu dokümanda HASSAS bilgi bulunmamaktadır. / This document does not contain SENSITIVE information. Date: 26/3/2012 Circular To All Real Estate Offices RERA extend to you our warmest regards Referring to the above subject (RERA) is pleased to announce that the implementation of Continuing Education Program has started as of January 2012. This program is mandatory. All brokers in Dubai are required to attend the program and pass the test as a prerequisite for broker ID renewal. For further information and registration please contact RERA at Telephone 04 203 0456 or email certifiedtraining@drie.ae Appreciate your co operation Director of Real Estate Licensing Department The Real Estate Regulatory Agency Date: 15/03/2017 2017/03/15 : agal Circular (03 2017) To The Attention of Property Portals Firms Dear Sirs Subject: Electronic Connectivity RERA extends its warmest regards and thank you for your cooperation In reference to the above mentioned subject based on the previous Circular No. (18 2016) dated (12.8.2016) we would like to inform you that the deadline to insure completing integrating procedures and compliance with the circular issued in this regard ending on the date of (01/04/2017). In the event of sites non compliance then legal action may be taken against them. Thank you for your cooperation. Yours Faithfully, Ali Abdullah Al Ali Director of Real Estate License Department Date: 12/03/2018 Circular(1 2018) To All Real Estate Companies and Institutions Greetings "
20,20," Bu dokümanda HASSAS bilgi bulunmamaktadır. / This document does not contain SENSITIVE information. Subject: Communicating with and sending Messages to real estate property owners RERA extends its warmest regards and thank you for your cooperation. In reference to the abovementioned subject, we would like to inform you that it is completely prohibited to communicate with or send text messages to real estate owners on their personal mobiles for the purpose of marketing a real estate or for offering company services. The Real Estate Companies and Institutions should advertise and market their real estate o properties through advertising channels whether in websites, newspapers, magazines or other advertisement channels. Therefore, they should get an ofﬁcial permit from Trakheesi system and write the permit number in the advertisement. In case of not adhering to the circular, legal procedures will be taken in this respect. Remark: Penalty's value: 50,000 Dirhams, in the event of repeating the violation, the amount shall be doubled. Thank you for your cooperation. Faithfully Yours, Eng. Marwan Bin Ghulaita CEO RERA The Real Estate Regulatory Agency RERA Government of Dubai Land Department Date: 02/11/2017 Circular (5 2017) Greetings to all real estate brokerage ﬁrms. Subject: Brokers Certiﬁcation Courses in Chinese Language RERA extends its warmest regards and thank you for your continued cooperation. In reference to the above mentioned subject, and in line with RERA's continuous effort to provide service to all real estate professionals in Dubai, we would like to inform you that Dubai Real Estate Institute offers now Brokers Certiﬁcation courses in Chinese Language. Kindly contact the Institute for further inquiries and registration. Faithfully Yours, Ali Abdullah Ali Director of Real Estate License Department The Real Estate Regulatory Agency Land Department Government of Dubai RERA The Real Estate Regulatory Agency Date: 26/07/2020 Circular(1 2020) To: Real Estate companies and agencies Subject: Increasing the number of ads in real estate permits Dear Real Estate companies and12 2016, and reference number 21 2016, and through communication with real estate companies to know their needs and provide services and facilities that encourage real estate players to adhere to the real estate permits and because of the ﬁnancial and economic consequences of COVID 19, we have increased the number of ads in real estate permits from 200 to 500 with the same value of the previous fee, as of the date of this circular. Regards, Manager Dubai Real Estate Licensing Dept. The Real Estate Regulatory Agency Land Department Government of Dubai RERA Date: 08/01/2017 2017/01/08 (1 2017) "
21,21," Bu dokümanda HASSAS bilgi bulunmamaktadır. / This document does not contain SENSITIVE information. To All Real Estate Brokerage and Real Estate Firms Greetings Subject: Smart Card of Brokers We would like to thank you for your continued cooperation. In our efforts to develop our services, facilitate procedures and upgrade our systems to becoming smarter, please note that its effective on 10 Jan 2017, issuance of all cards related to brokers, developers and other related activities. Shall be suspended and replaced by the smart card available on Dubai Brokers Application and DLD website (www.dubailand.gov.ae). The application allows printing of the card if required. For more inquiries, please contact the call center: 8004488. Thank you. Faithfully Yours, Ali Abdulla Al Ali Director of Real Estate License Department The Real Estate Regulatory Agency Land Department Government of Dubai RERA Date: 02 11 2016 Circular (13 2016) To Real Estate Brokerage Firms Greetings Subject: Marketing real estate properties from abroad RERA extends its warmest regards and thank you for your cooperation. In reference to the aforementioned subject, we would like to inform you that real estate brokerage offices desiring to promote and advertise real estate properties from abroad shall adhere to the following: Duly obtaining a marketing permit from RERA through (Trakheesi) system A copy of the Marketing Contract executed between the brokerage firm and the property owner A copy of the title deed attested by the UAE Embassy, Ministry of Foreign Affairs, and translated into Arabic by a certified translation office "
